{
  "api_version": "1",
  "command": "context",
  "status": "partial",
  "data": {
    "records": [
      {
        "record": {"schema_version":"1","id":"app","name":"Application","summary":"Coordinates reports."},
        "descriptor": "archie.yaml",
        "links": [{"relation":"child","target":"renderer","description":"Renders reports."}],
        "reasons": ["ancestor","root"]
      },
      {
        "record": {"schema_version":"1","id":"renderer","name":"Renderer","summary":"Renders reports.","links":[{"relation":"source","target":"src/render.go","description":"Rendering implementation."}]},
        "descriptor": "renderer.archie.yaml",
        "links": [{"relation":"parent","target":"app","description":"Coordinates reports."},{"relation":"source","target":"src/render.go","description":"Rendering implementation."}],
        "reasons": ["keyword"]
      }
    ],
    "evidence": [{"record_id":"renderer","relation":"source","target":"src/render.go","state":"unknown","reason":"no_baseline"}]
  },
  "diagnostics": [{"code":"BUDGET_EXHAUSTED","message":"Record limit reached."}],
  "coverage": {
    "metadata": {"discovered":3,"loaded":3,"excluded":0,"invalid":0,"complete":true},
    "selection": {"matched":3,"returned":2,"omitted":1},
    "evidence": {"total":1,"checked":1,"unchecked":0},
    "omissions": [{"reason":"record_budget","count":1,"paths":["mailer.archie.yaml"]}]
  },
  "continuation": {
    "cursor": "eyJ2IjoiMSIsInF1ZXJ5IjoiMDAwMDAwMDAwMDAwMDAwMDAwMDAwMDAwMDAwMDAwMDAwMDAwMDAwMDAwMDAwMDAwMDAwMDAwMDAwMDAwMDAwMCIsInNuYXBzaG90IjoiMDAwMDAwMDAwMDAwMDAwMDAwMDAwMDAwMDAwMDAwMDAwMDAwMDAwMDAwMDAwMDAwMDAwMDAwMDAwMDAwMDAwMCIsIm9mZnNldCI6Mn0",
    "remaining": 1
  },
  "baseline": {"requested":"","resolved":"","state":"none","reason":"not_supplied"}
}
